--
-- VACUUM
--
CREATE TABLE vactst (i INT) with (orientation = column) DISTRIBUTE BY REPLICATION;
INSERT INTO vactst VALUES (1);
INSERT INTO vactst SELECT * FROM vactst;
INSERT INTO vactst SELECT * FROM vactst;
INSERT INTO vactst SELECT * FROM vactst;
INSERT INTO vactst SELECT * FROM vactst;
INSERT INTO vactst SELECT * FROM vactst;
INSERT INTO vactst SELECT * FROM vactst;
INSERT INTO vactst SELECT * FROM vactst;
INSERT INTO vactst SELECT * FROM vactst;
INSERT INTO vactst SELECT * FROM vactst;
INSERT INTO vactst SELECT * FROM vactst;
INSERT INTO vactst SELECT * FROM vactst;
INSERT INTO vactst VALUES (0);
SELECT count(*) FROM vactst;
 count 
-------
  2049
(1 row)

DELETE FROM vactst WHERE i != 0;
SELECT * FROM vactst;
 i 
---
 0
(1 row)

VACUUM FULL vactst;
UPDATE vactst SET i = i + 1;
INSERT INTO vactst SELECT * FROM vactst;
INSERT INTO vactst SELECT * FROM vactst;
INSERT INTO vactst SELECT * FROM vactst;
INSERT INTO vactst SELECT * FROM vactst;
INSERT INTO vactst SELECT * FROM vactst;
INSERT INTO vactst SELECT * FROM vactst;
INSERT INTO vactst SELECT * FROM vactst;
INSERT INTO vactst SELECT * FROM vactst;
INSERT INTO vactst SELECT * FROM vactst;
INSERT INTO vactst SELECT * FROM vactst;
INSERT INTO vactst SELECT * FROM vactst;
INSERT INTO vactst VALUES (0);
SELECT count(*) FROM vactst;
 count 
-------
  2049
(1 row)

DELETE FROM vactst WHERE i != 0;
VACUUM (FULL) vactst;
DELETE FROM vactst;
SELECT * FROM vactst;
 i 
---
(0 rows)

VACUUM (FULL, FREEZE) vactst;
VACUUM (ANALYZE, FULL) vactst;
CREATE TABLE vaccluster (i INT PRIMARY KEY) with (orientation = column);
ALTER TABLE vaccluster CLUSTER ON vaccluster_pkey;
ERROR:  Unsupported ALTER TABLE operations for column table
CLUSTER vaccluster;
ERROR:  cannot cluster column-store tables
CREATE FUNCTION do_analyze() RETURNS VOID VOLATILE LANGUAGE SQL
	AS 'ANALYZE pg_am';
CREATE FUNCTION wrap_do_analyze(c INT) RETURNS INT IMMUTABLE LANGUAGE SQL
	AS 'SELECT $1 FROM do_analyze()';
CREATE INDEX ON vaccluster(wrap_do_analyze(i));
INSERT INTO vaccluster VALUES (1), (2);
ANALYZE vaccluster;
ERROR:  ANALYZE cannot be executed from VACUUM or ANALYZE
VACUUM FULL pg_am;
VACUUM FULL pg_class;
VACUUM FULL pg_catalog.pg_database;
VACUUM FULL vaccluster;
ERROR:  cannot DROP INDEX "vaccluster_pkey_CVM_TEMP" because it is being used by active queries in this session
VACUUM FULL vactst;
VACUUM (DISABLE_PAGE_SKIPPING) vaccluster;
DROP TABLE vaccluster;
DROP TABLE vactst;
DROP FUNCTION do_analyze;
DROP FUNCTION wrap_do_analyze;
-- partitioned table
CREATE TABLE vacparted (a int, b char) PARTITION BY LIST (a) with (orientation = column);
CREATE TABLE vacparted1 PARTITION OF vacparted FOR VALUES IN (1);
INSERT INTO vacparted VALUES (1, 'a');
UPDATE vacparted SET b = 'b';
VACUUM (ANALYZE) vacparted;
VACUUM (FULL) vacparted;
VACUUM (FREEZE) vacparted;
DROP TABLE vacparted;
-- schema and table name with special character
CREATE SCHEMA "S-test";
CREATE TABLE "eg_sync-cc0vf52i" (id int);
CREATE TABLE "2ac" (id int);
CREATE TABLE "ASD2" (id int);
CREATE TABLE "S-test"."2ac" (id int);
ANALYZE "eg_sync-cc0vf52i";
ANALYZE public."eg_sync-cc0vf52i";
ANALYZE "public"."eg_sync-cc0vf52i";
ANALYZE "2ac";
ANALYZE "ASD2";
ANALYZE "S-test"."2ac";
DROP TABLE "eg_sync-cc0vf52i","2ac","ASD2","S-test"."2ac";
DROP SCHEMA "S-test";
