CREATE TABLE delete_test (
    id SERIAL PRIMARY KEY,
    a INT,
    b text
);
INSERT INTO delete_test (a) VALUES (10);
INSERT INTO delete_test (a, b) VALUES (50, repeat('x', 10000));
INSERT INTO delete_test (a) VALUES (100);
-- allow an alias to be specified for DELETE's target table
DELETE FROM delete_test AS dt WHERE dt.a > 75;
-- if an alias is specified, don't allow the original table name
-- to be referenced
DELETE FROM delete_test dt WHERE delete_test.a > 25;
ERROR:  invalid reference to FROM-clause entry for table "delete_test"
LINE 1: DELETE FROM delete_test dt WHERE delete_test.a > 25;
                                         ^
HINT:  Perhaps you meant to reference the table alias "dt".
SELECT id, a, char_length(b) FROM delete_test ORDER BY id;
 id | a  | char_length 
----+----+-------------
  1 | 10 |            
  2 | 50 |       10000
(2 rows)

-- delete a row with a TOASTed value
DELETE FROM delete_test WHERE a > 25;
SELECT id, a, char_length(b) FROM delete_test ORDER BY id;
 id | a  | char_length 
----+----+-------------
  1 | 10 |            
(1 row)

DROP TABLE delete_test;
create table t1(f11 int, f12 int) distribute by replication;
create table t2(f21 int, f22 int);
explain (costs off) delete from t1 using t2 where t1.f11=t2.f21;
              QUERY PLAN               
---------------------------------------
 Delete on t1
   ->  Merge Join
         Merge Cond: (t1.f11 = t2.f21)
         ->  Sort
               Sort Key: t1.f11
               ->  Seq Scan on t1
         ->  Sort
               Sort Key: t2.f21
               ->  Seq Scan on t2
(9 rows)

explain (costs off) delete from t2 using t1 where t1.f11=t2.f21;
              QUERY PLAN               
---------------------------------------
 Delete on t2
   ->  Merge Join
         Merge Cond: (t2.f21 = t1.f11)
         ->  Sort
               Sort Key: t2.f21
               ->  Seq Scan on t2
         ->  Sort
               Sort Key: t1.f11
               ->  Seq Scan on t1
(9 rows)

explain (costs off) delete from t1 test1 using t1 test2 
                    where test2.f11 <= some(select distinct max(f11)
			                    over(partition by f12)
					    from t1);
                              QUERY PLAN                               
-----------------------------------------------------------------------
 Delete on t1 test1
   ->  Nested Loop
         ->  Seq Scan on t1 test1
         ->  Materialize
               ->  Nested Loop Semi Join
                     Join Filter: (test2.f11 <= any_subquery_1.max)
                     ->  Seq Scan on t1 test2
                     ->  Materialize
                           ->  Subquery Scan on any_subquery_1
                                 ->  HashAggregate
                                       Group Key: max(t1.f11) OVER (?)
                                       ->  WindowAgg
                                             ->  Sort
                                                   Sort Key: t1.f12
                                                   ->  Seq Scan on t1
(15 rows)

drop table t1;
drop table t2;
create table test_v(id varchar(10),id1 varchar(10),primary key(id,id1)) distribute by shard(id);
create table test1_v(id varchar(10),id1 varchar(10),primary key(id,id1)) distribute by shard(id1);
explain (costs off)
delete from test_v t1
where exists(select 1 from test1_v t2
             where t1.id=t2.id and t1.id1=t2.id1);
                                         QUERY PLAN                                         
--------------------------------------------------------------------------------------------
 Delete on test_v t1
   ->  Hash Join
         Hash Cond: (((t1.id)::text = (t2.id)::text) AND ((t1.id1)::text = (t2.id1)::text))
         ->  Seq Scan on test_v t1
         ->  Hash
               ->  Seq Scan on test1_v t2
(6 rows)

drop table test_v;
drop table test1_v;
CREATE TABLE rqg_table2401 (
c0 int,
c1 int);
CREATE TABLE rqg_table2402 (
c0 int,
c1 int) distribute by replication;
CREATE TABLE rqg_table2403 (
c0 int,
c1 int);
DELETE FROM rqg_table2402 m1 USING (
rqg_table2403 AS a1 INNER JOIN rqg_table2401 AS a2 ON a1.c0 = a2.c0
INNER JOIN rqg_table2401 AS a3 ON a1.c0 = a3.c0);
drop table rqg_table2401;
drop table rqg_table2402;
drop table rqg_table2403;
